name,college,location,hub_location,title
Candidates 1,University of Texas at San Antonio,One UTSA Circle San Antonio TX 78249,Dallas,SE
Candidates 2,University of Incarnate Ward,4301 Broadway San Antonio TX 78209,Dallas,SE
Candidates 3,University of Texas at Austin,110 Inner Campus Drive Stop G0400 Austin TX 78712,Dallas,TBM
Candidates 4,Southern Methodist University,6425 Boaz Lane Dallas TX 75205,Atlanta,NEO
Candidates 5,Harvard,One UTSA Circle San Antonio TX 78249,Dallas,SE
Candidates 6,Northwestern,4301 Broadway San Antonio TX 78209,Dallas,SE
Candidates 7,University of Texas at Austin,110 Inner Campus Drive Stop G0400 Austin TX 78712,Dallas,TBM
Candidates 8,Southern Methodist University,6425 Boaz Lane Dallas TX 75205,Atlanta,NEO